{
  "schemaVersion": 1,
  "brandVersion": "v1",
  "product": {
    "name": "Bayanly AI",
    "shortName": "Bayanly",
    "description": "An AI-powered platform for creating professional presentations in Arabic and English.",
    "supportEmail": "Ayman.Naeem@gmail.com"
  },
  "publisher": {
    "displayName": "Bayanly Technologies",
    "legalStatus": "REQUIRES_LEGAL_REVIEW"
  },
  "web": {
    "requestedDomain": "example.ai",
    "canonicalUrl": "https://example.ai",
    "isPlaceholder": true,
    "operationalStatus": "REQUIRES_DOMAIN_CONFIGURATION"
  },
  "desktop": {
    "requestedName": "Bayanly",
    "requestedAppId": "ai.bayanly.desktop",
    "activeAppId": "com.presenton.presenton",
    "appIdStatus": "COMPATIBILITY_RETAINED",
    "requestedProtocol": "bayanly",
    "requestedProtocolExample": "bayanly://open",
    "protocolStatus": "REQUIRES_INSTALLER_AND_SECURITY_REVIEW",
    "requestedUpdateDomain": "updates.bayanly.ai",
    "updateStatus": "REQUIRES_UPDATE_CHANNEL_CONFIGURATION",
    "compatibilityUpdateUrl": "https://raw.githubusercontent.com/presenton/presenton/refs/heads/main/electron/version.json",
    "compatibilityDownloadUrl": "https://presenton.ai/download"
  },
  "colors": {
    "primary": "#1677FF",
    "secondary": "#22D3EE",
    "accent": "#00F0FF",
    "background": "#061538",
    "text": "#F8FAFC"
  },
  "assets": {
    "sourceDirectory": "assets/branding",
    "webBasePath": "/brand/v1",
    "electronBuildDirectory": "build/brand/v1",
    "primaryLogo": "primary-logo.png",
    "lightLogo": "light-logo.png",
    "darkLogo": "dark-logo.png",
    "compactIcon": "compact-icon.png",
    "favicon": "favicon.png",
    "desktopIcon": "desktop-icon.png",
    "splash": "splash.png"
  },
  "featureFlags": {
    "newBrandShell": { "environment": "NEW_BRAND_SHELL_ENABLED", "default": true },
    "newExportMetadata": { "environment": "NEW_EXPORT_METADATA_ENABLED", "default": false }
  },
  "upstream": {
    "name": "Presenton",
    "repository": "https://github.com/presenton/presenton",
    "license": "Apache-2.0",
    "relationship": "derived-work"
  }
}
